Solution for the implementation of interstitial ads of admob (SwiftUI),https://stackoverflow.com/questions/74508207/solution-for-the-implementation-of-interstitial-ads-of-admob-swiftui
C# MaxBy() is there a way to get multiple max values?,https://stackoverflow.com/questions/74508206/c-sharp-maxby-is-there-a-way-to-get-multiple-max-values
Neo4j Cypher exclude nodes where a specific relationship is missing,https://stackoverflow.com/questions/74508205/neo4j-cypher-exclude-nodes-where-a-specific-relationship-is-missing
ER diagram with Blockchain,https://stackoverflow.com/questions/74508204/er-diagram-with-blockchain
MySQL trigger - how to update specific row in another table,https://stackoverflow.com/questions/74508203/mysql-trigger-how-to-update-specific-row-in-another-table
How to use Oculus Rift as a MOVING virtual camera in UE5?,https://stackoverflow.com/questions/74508202/how-to-use-oculus-rift-as-a-moving-virtual-camera-in-ue5
Mobile applications for defining private VPNs,https://stackoverflow.com/questions/74508201/mobile-applications-for-defining-private-vpns
Detect the iframe is opening from mobile webbrowser or mobile Applicationmobile,https://stackoverflow.com/questions/74508199/detect-the-iframe-is-opening-from-mobile-webbrowser-or-mobile-applicationmobile
I am trying to learn delay() function but its not working it gives me error :‘delay’ was not declared in this scope. I tried wiat() and sleep same,https://stackoverflow.com/questions/74508198/i-am-trying-to-learn-delay-function-but-its-not-working-it-gives-me-error-de
How MIGHT I ORGANIZE MY PHOTOS USING AWS Rekognition and Python?,https://stackoverflow.com/questions/74508195/how-might-i-organize-my-photos-using-aws-rekognition-and-python
Newton Raphson Algorithm in R for Implied volatility,https://stackoverflow.com/questions/74508193/newton-raphson-algorithm-in-r-for-implied-volatility
Can you slice it?,https://stackoverflow.com/questions/74508192/can-you-slice-it
C++ Destructor of Vector,https://stackoverflow.com/questions/74508191/c-destructor-of-vector
Delphi 11.2: CreateWindowEx fails thread on x64,https://stackoverflow.com/questions/74508190/delphi-11-2-createwindowex-fails-thread-on-x64
Keep rows according to condition in Pandas,https://stackoverflow.com/questions/74508189/keep-rows-according-to-condition-in-pandas
How do I get the users current location by java in Android Studio,https://stackoverflow.com/questions/74508188/how-do-i-get-the-users-current-location-by-java-in-android-studio
Emscripten and C++ 20,https://stackoverflow.com/questions/74508184/emscripten-and-c-20
MSSQL: STRING_AGG with in Group does not work,https://stackoverflow.com/questions/74508182/mssql-string-agg-with-in-group-does-not-work
Most efficient way to read 4000 Imgs and gather them in shape of a Matrix,https://stackoverflow.com/questions/74508180/most-efficient-way-to-read-4000-imgs-and-gather-them-in-shape-of-a-matrix
Bigquery insert into table select command cost,https://stackoverflow.com/questions/74508177/bigquery-insert-into-table-select-command-cost
Pull line item data from plugin,https://stackoverflow.com/questions/74508175/pull-line-item-data-from-plugin
Preventing barcode scanning using Ml-kit from triggering a function call twice,https://stackoverflow.com/questions/74508174/preventing-barcode-scanning-using-ml-kit-from-triggering-a-function-call-twice
static member definition outside class template template,https://stackoverflow.com/questions/74508173/static-member-definition-outside-class-template-template
how to properly calculate sum of digits from specific place in file? (YASM 8086),https://stackoverflow.com/questions/74508170/how-to-properly-calculate-sum-of-digits-from-specific-place-in-file-yasm-8086
The propriety 'setEstado' doesnt exist on type 'number | IContexto'.ts(2339),https://stackoverflow.com/questions/74508169/the-propriety-setestado-doesnt-exist-on-type-number-icontexto-ts2339
use a function inside shiny server with options being reactive values,https://stackoverflow.com/questions/74508168/use-a-function-inside-shiny-server-with-options-being-reactive-values
"Can't use mat-grid-list ERROR DOMException: Failed to execute 'setAttribute' on 'Element': ',' is not a valid attribute name",https://stackoverflow.com/questions/74508167/cant-use-mat-grid-list-error-domexception-failed-to-execute-setattribute-on
Determining whether an expression has omega complexity,https://stackoverflow.com/questions/74508166/determining-whether-an-expression-has-omega-complexity
"Prolog different variable, same value",https://stackoverflow.com/questions/74508165/prolog-different-variable-same-value
How to add extral sample data into PCA result but will not change the original scale?,https://stackoverflow.com/questions/74508162/how-to-add-extral-sample-data-into-pca-result-but-will-not-change-the-original-s
Data is not rendering properly angular,https://stackoverflow.com/questions/74508153/data-is-not-rendering-properly-angular
"TYPO3 10.4 - How add in hreflang, more Output, only 2 BE Language?",https://stackoverflow.com/questions/74508150/typo3-10-4-how-add-in-hreflang-more-output-only-2-be-language
"Havinf this list of dictionaries, how do I acces particulr lines and compare diffrent lines with each other?",https://stackoverflow.com/questions/74508147/havinf-this-list-of-dictionaries-how-do-i-acces-particulr-lines-and-compare-dif
`TypeError: cannot pickle 'weakref' object` and `EOFError: Ran out of input` when trying to nest processes,https://stackoverflow.com/questions/74508141/typeerror-cannot-pickle-weakref-object-and-eoferror-ran-out-of-input-whe
How can I fix package does not exist and cannot find symbol errors when compiling using javac?,https://stackoverflow.com/questions/74508139/how-can-i-fix-package-does-not-exist-and-cannot-find-symbol-errors-when-compilin
What is the type of this 40pin female display plug?,https://stackoverflow.com/questions/74508138/what-is-the-type-of-this-40pin-female-display-plug
Prevent last newline at end of file [duplicate],https://stackoverflow.com/questions/74508137/prevent-last-newline-at-end-of-file
how do i solve this for loop related problem in c language,https://stackoverflow.com/questions/74508133/how-do-i-solve-this-for-loop-related-problem-in-c-language
Shell script: know when there is redirected input,https://stackoverflow.com/questions/74508131/shell-script-know-when-there-is-redirected-input
Would it be a good idea if POSIX commands had a flag to output standardized JSON or YAML?,https://stackoverflow.com/questions/74508128/would-it-be-a-good-idea-if-posix-commands-had-a-flag-to-output-standardized-json
Does I need a spring boot oauth2 authorization server to generate a custom JWT and a JWKS endpoint?,https://stackoverflow.com/questions/74508126/does-i-need-a-spring-boot-oauth2-authorization-server-to-generate-a-custom-jwt-a
Append a nested dictionary to a dictionary in python,https://stackoverflow.com/questions/74508125/append-a-nested-dictionary-to-a-dictionary-in-python
Access a field of another field that is a trait,https://stackoverflow.com/questions/74508124/access-a-field-of-another-field-that-is-a-trait
Changing return variable depending on input. [AppScript],https://stackoverflow.com/questions/74508122/changing-return-variable-depending-on-input-appscript
I create app send notification after long time like day or week or month what function can I use?,https://stackoverflow.com/questions/74508120/i-create-app-send-notification-after-long-time-like-day-or-week-or-month-what-fu
Unable to post image in mongoDB from react using axios,https://stackoverflow.com/questions/74508117/unable-to-post-image-in-mongodb-from-react-using-axios
Docker container not copying certificate,https://stackoverflow.com/questions/74508116/docker-container-not-copying-certificate
A recursive operation that prints the sum of N number of variations,https://stackoverflow.com/questions/74508114/a-recursive-operation-that-prints-the-sum-of-n-number-of-variations
Tar verify on linux,https://stackoverflow.com/questions/74508113/tar-verify-on-linux
can i use Database tables without relationships?,https://stackoverflow.com/questions/74508107/can-i-use-database-tables-without-relationships
